{
  "$id": "bureau_continuity_ledger_v1.schema.json", "$schema": "https://json-schema.org/draft/2020-12/schema",
  "type": "object", "additionalProperties": false,
  "required": ["schema_version", "artifact_type", "artifact_id", "property_id", "episode_id", "created_at", "generator_version", "upstream_artifacts", "retention_limit", "entries"],
  "properties": {
    "schema_version": {"$ref": "common_defs_v1.schema.json#/$defs/schema_version"}, "artifact_type": {"const": "bureau_continuity_ledger_v1"}, "artifact_id": {"$ref": "common_defs_v1.schema.json#/$defs/artifact_id"}, "property_id": {"$ref": "common_defs_v1.schema.json#/$defs/property_id"}, "episode_id": {"$ref": "common_defs_v1.schema.json#/$defs/episode_id"}, "created_at": {"$ref": "common_defs_v1.schema.json#/$defs/created_at"}, "generator_version": {"$ref": "common_defs_v1.schema.json#/$defs/generator_version"}, "upstream_artifacts": {"$ref": "common_defs_v1.schema.json#/$defs/upstream_artifacts"},
    "retention_limit": {"type": "integer", "minimum": 30, "maximum": 1000},
    "entries": {"type": "array", "minItems": 1, "maxItems": 1000, "items": {"type": "object", "additionalProperties": false, "required": ["episode_id", "title", "world_rule", "creative_genome", "hazard", "entities", "environments", "silhouettes", "palette", "camera_grammar", "hook", "instructions", "reveal", "closing_line", "lore_hooks", "performance_metrics", "future_lockouts"], "properties": {"episode_id": {"$ref": "common_defs_v1.schema.json#/$defs/episode_id"}, "title": {"$ref": "common_defs_v1.schema.json#/$defs/nonempty_string"}, "world_rule": {"$ref": "common_defs_v1.schema.json#/$defs/nonempty_string"}, "creative_genome": {"$ref": "common_defs_v1.schema.json#/$defs/genome_snapshot"}, "hazard": {"$ref": "common_defs_v1.schema.json#/$defs/nonempty_string"}, "entities": {"$ref": "common_defs_v1.schema.json#/$defs/string_list"}, "environments": {"$ref": "common_defs_v1.schema.json#/$defs/string_list"}, "silhouettes": {"$ref": "common_defs_v1.schema.json#/$defs/string_list"}, "palette": {"$ref": "common_defs_v1.schema.json#/$defs/string_list"}, "camera_grammar": {"$ref": "common_defs_v1.schema.json#/$defs/nonempty_string"}, "hook": {"$ref": "common_defs_v1.schema.json#/$defs/nonempty_string"}, "instructions": {"$ref": "common_defs_v1.schema.json#/$defs/string_list"}, "reveal": {"$ref": "common_defs_v1.schema.json#/$defs/nonempty_string"}, "closing_line": {"$ref": "common_defs_v1.schema.json#/$defs/nonempty_string"}, "lore_hooks": {"$ref": "common_defs_v1.schema.json#/$defs/string_list"}, "performance_metrics": {"type": "object", "additionalProperties": false, "required": ["status"], "properties": {"status": {"enum": ["unavailable", "pending", "available"]}}}, "future_lockouts": {"$ref": "common_defs_v1.schema.json#/$defs/tag_list"}}}}
  }
}
